{
  "schema_version": 1,
  "workflow": "validate_companies",
  "task_id": "company:webdevelop-pro:luna:7e48242e77b54672",
  "attempt_id": "attempt:61053443-e709-44e6-b929-b17918955bf9",
  "claim_token": "lJ5v8DYfnCwP3fLkmEJD7a3KNrWlwbPzBWe2e5xyOGs",
  "model": "luna",
  "created_at": "2026-09-01T18:12:00Z",
  "target": {"company_ids": ["webdevelop-pro"], "source_ids": ["webdevelop-pro-primary"]},
  "outcome": "resolved",
  "reason_code": "validated",
  "evidence": [
    {"url": "https://webdevelop.pro/careers", "retrieved_at": "2026-09-01T18:12:00Z", "evidence_type": "official_careers_page", "finding": "Official Webdevelop.PRO careers page is live and lists Unique Talents, English Teacher, and Sales Manager opportunities with application links."},
    {"url": "https://webdevelop.pro/", "retrieved_at": "2026-09-01T18:12:00Z", "evidence_type": "official_company_site", "finding": "The official company site identifies Webdevelop.PRO as a software development company."}
  ],
  "patch": {
    "company_id": "webdevelop-pro",
    "expected_record_revision": 1,
    "company_changes": {},
    "source_upserts": [{
      "source_id": "webdevelop-pro-primary",
      "company_id": "webdevelop-pro",
      "expected_record_revision": 1,
      "careers_url": "https://webdevelop.pro/careers",
      "listings_url": "https://webdevelop.pro/careers",
      "provider": "custom",
      "board_id": null,
      "access_mode": "browser_required",
      "scope": "All Webdevelop.pro roles",
      "instructions": "Official careers page is available, but role links do not expose a stable structured endpoint for automated enumeration; recheck before enabling automated enumeration.",
      "capabilities": {"complete_enumeration": false, "stable_job_identity": false, "structured_data": false},
      "status": "unsupported",
      "official_relationship_url": "https://webdevelop.pro/",
      "checked_at": "2026-09-01T18:12:00Z",
      "last_success_at": null,
      "added_date": "2026-08-28T23:05:12Z",
      "updated_date": "2026-09-01T18:12:00Z"
    }]
  },
  "item_results": [{"item": "webdevelop-pro-primary", "status": "resolved", "summary": "Official careers page verified; source remains unsupported for structured enumeration."}],
  "failure_class": null,
  "notes": "Canonical source metadata refreshed; no company identity changes."
}
