{
  "schema_version": 1,
  "workflow": "validate_companies",
  "task_id": "company:woebot-labs:luna:f1b3ee3cf1ca0337",
  "attempt_id": "attempt:1f845bd6-e98f-488e-b691-80bdf7f2f148",
  "claim_token": "MfhrEs0Xdu4W8DsRgNJz9H9NF-6sX7AtDQcnUtT926I",
  "model": "luna",
  "created_at": "2026-09-01T18:13:00Z",
  "target": {"company_ids": ["woebot-labs"], "source_ids": ["woebot-labs-primary"]},
  "outcome": "resolved",
  "reason_code": "validated",
  "evidence": [
    {"url": "https://woebothealth.com/careers/", "retrieved_at": "2026-09-01T18:13:00Z", "evidence_type": "official_careers_page", "finding": "Woebot Health's official Careers page describes current hiring and provides a View job openings action."},
    {"url": "https://woebothealth.com/", "retrieved_at": "2026-09-01T18:13:00Z", "evidence_type": "official_company_site", "finding": "The official site identifies Woebot Health and links visitors to open positions."}
  ],
  "patch": {
    "company_id": "woebot-labs",
    "expected_record_revision": 1,
    "company_changes": {},
    "source_upserts": [{
      "source_id": "woebot-labs-primary",
      "company_id": "woebot-labs",
      "expected_record_revision": 1,
      "careers_url": "https://woebothealth.com/careers/",
      "listings_url": "https://woebothealth.com/careers/",
      "provider": "custom",
      "board_id": null,
      "access_mode": "browser_required",
      "scope": "All Woebot Labs roles",
      "instructions": "Official Careers page is available, but no stable structured role-detail endpoint was exposed; recheck before enabling automated enumeration.",
      "capabilities": {"complete_enumeration": false, "stable_job_identity": false, "structured_data": false},
      "status": "unsupported",
      "official_relationship_url": "https://woebothealth.com/",
      "checked_at": "2026-09-01T18:13:00Z",
      "last_success_at": null,
      "added_date": "2026-08-28T23:01:48Z",
      "updated_date": "2026-09-01T18:13:00Z"
    }]
  },
  "item_results": [{"item": "woebot-labs-primary", "status": "resolved", "summary": "Official Careers page verified; source remains unsupported for structured enumeration."}],
  "failure_class": null,
  "notes": "Canonical source metadata refreshed; no company identity changes."
}
