{
  "schema_version": 1,
  "workflow": "validate_companies",
  "task_id": "company:truefoundry:luna:b7b1044104a3f4a3",
  "attempt_id": "attempt:6a0dcc8c-14a1-45f0-983c-97c9cd78109f",
  "claim_token": "ofqD6LzLL-a24dxMSU7pd33PJqAsqtPxZpi5dl4T3zU",
  "model": "luna",
  "created_at": "2026-09-01T18:04:54Z",
  "target": {"company_ids": ["truefoundry"], "source_ids": ["truefoundry-primary"]},
  "outcome": "resolved",
  "reason_code": "validated",
  "evidence": [{"url": "https://www.truefoundry.com/careers", "retrieved_at": "2026-09-01T18:05:25Z", "evidence_type": "official_careers_page", "finding": "The official TrueFoundry careers page states that the company is actively hiring and exposes a careers/open-positions control, but no complete stable role enumeration endpoint was verified in this bounded pass; the source remains unsupported."}, {"url": "https://www.truefoundry.com/blog/announcing-our-19m-series-a-scaling-ai-deployment-with-autonomous-agents-on-autopilot", "retrieved_at": "2026-09-01T18:05:25Z", "evidence_type": "official_company_page", "finding": "TrueFoundry's official announcement directs applicants to its careers channel and careers@truefoundry.com, confirming the employer relationship."}],
  "patch": {"company_id": "truefoundry", "expected_record_revision": 1, "company_changes": {}, "source_upserts": [{
    "source_id": "truefoundry-primary", "company_id": "truefoundry", "expected_record_revision": 1, "careers_url": "https://www.truefoundry.com/careers", "listings_url": "https://www.truefoundry.com/careers", "provider": "custom", "board_id": null, "access_mode": "html_listing", "scope": "All TrueFoundry roles", "instructions": "Review the official careers page and its open-positions control; do not scan until a complete stable role enumeration endpoint is verified.", "capabilities": {"complete_enumeration": false, "stable_job_identity": false, "structured_data": false}, "status": "unsupported", "official_relationship_url": "https://www.truefoundry.com/careers", "checked_at": "2026-09-01T18:05:25Z", "last_success_at": null, "added_date": "2026-08-28T23:05:12Z", "updated_date": "2026-09-01T18:05:25Z"
  }]},
  "item_results": [{"item": "truefoundry-primary", "status": "resolved", "summary": "Official hiring page and employer relationship confirmed; stable complete enumeration remains unverified."}],
  "failure_class": null,
  "notes": "No canonical company identity or address change supported."
}
